{
  "result_schema_version": 1,
  "task_id": "T-0020",
  "outcome": "completed",
  "summary": "Deny-by-default Authorizer: RBAC (nested built-in roles, capped custom roles, ownership, escalation, last owner, separate system trust level, MFA/recency, credential bounds) and optional Cedar engine; OrgAccess proof type required by tenant repositories.",
  "changes": [],
  "decisions": [],
  "validation": [
    {
      "cmd": null,
      "evidence": "python3 tools/ai-validate (Rust fmt/clippy/sqlx/tests/cedar + web typecheck/lint/test/build/budget) and Playwright 12/12 E2E PASS on 2026-10-04",
      "passed": true
    },
    {
      "cmd": null,
      "evidence": "authz conformance 13 + RBAC/Cedar differential proptest; tenancy.rs 7; E2E outsider 404 + member 403 on audit",
      "passed": true
    }
  ],
  "unresolved": [],
  "lessons": [],
  "next_steps": [],
  "created_at": "2026-10-04T09:59:33Z"
}
