{
  "result_schema_version": 1,
  "task_id": "T-0016",
  "outcome": "completed",
  "summary": "Generated applications validated end to end: three fresh profiles (core/basic, performance/b2b/cedar, distributed/b2b) pass validate-generated; two clean-room agents built secure features from repository-local information; live failure drill and browser acceptance against the full stack.",
  "changes": [],
  "decisions": [],
  "validation": [
    {
      "cmd": null,
      "evidence": "validate-generated: minimal ./dev check 22/22, smoke 10 pass 3 skip; saas 24/24, smoke 10/3; throughput 25/25, smoke 12 pass 1 skip; module presence/absence and runtime configuration verified (2026-10-05, blueprint 60f7e91; regeneration from 9efafc8 differs only in provenance stamps)",
      "passed": true
    },
    {
      "cmd": null,
      "evidence": "./dev test --drill: 14/14 (provider 429/5xx/timeout/outage, backlog, ClickHouse/NATS/PostgreSQL down and back, forged session, missing CSRF)",
      "passed": true
    },
    {
      "cmd": null,
      "evidence": "./dev test --journey: 6/6 browser acceptance per role, 27 screenshots",
      "passed": true
    },
    {
      "cmd": null,
      "evidence": "clean-room runs: Projects (23/23) and Announcements (22/22), cross-tenant 404 and member 403 live",
      "passed": true
    }
  ],
  "unresolved": [],
  "lessons": [],
  "next_steps": [],
  "created_at": "2026-10-05T05:04:13Z"
}
