{
  "result_schema_version": 1,
  "task_id": "T-0023",
  "outcome": "completed",
  "summary": "Account center and system admin APIs with independent require_system checks, MFA enforcement, recent-auth deletion workflow with sole-owner policy and IdP deactivation hook.",
  "changes": [],
  "decisions": [],
  "validation": [
    {
      "cmd": null,
      "evidence": "python3 tools/ai-validate (Rust fmt/clippy/sqlx/tests/cedar + web typecheck/lint/test/build/budget) and Playwright 12/12 E2E PASS on 2026-10-04",
      "passed": true
    },
    {
      "cmd": null,
      "evidence": "admin.rs 6, account.rs 4; E2E admin MFA step-up",
      "passed": true
    }
  ],
  "unresolved": [],
  "lessons": [],
  "next_steps": [],
  "created_at": "2026-10-04T09:59:33Z"
}
