{
  "result_schema_version": 1,
  "task_id": "T-0001",
  "outcome": "completed",
  "summary": "Objective recorded from the user's mission brief; constraints captured; 16 implementation tasks (T-0002..T-0017) created across milestones M1-M6; absence of runnable validation recorded in KNOWN_ISSUES.",
  "changes": [],
  "decisions": [],
  "validation": [
    {
      "cmd": null,
      "evidence": "python3 tools/ai-check: OK",
      "passed": true
    },
    {
      "cmd": null,
      "evidence": "python3 tools/ai-task list shows T-0002..T-0017 queued with dependencies",
      "passed": true
    }
  ],
  "unresolved": [],
  "lessons": [],
  "next_steps": [],
  "created_at": "2026-10-04T07:56:03Z"
}
