{
  "result_schema_version": 1,
  "task_id": "T-0027",
  "outcome": "completed",
  "summary": "Per-project development ports: infra/dev-ports.env read by ./dev, compose, Vite, Playwright, validation commands, smoke scripts and benchmarks; generator assigns a 32-port block (--port-base); preflight names port holders; readiness checks the spawned process; project-scoped smoke/systemd names; per-project session cookie.",
  "changes": [],
  "decisions": [],
  "validation": [
    {
      "cmd": null,
      "evidence": "Before: ./dev up failed with Docker 'port is already allocated' and left uwsb-postgres-1 created without ports",
      "passed": true
    },
    {
      "cmd": null,
      "evidence": "Two generated projects (core 20736-, performance 23968-) ran ./dev up concurrently next to another stack on the default ports; both ./dev test --system 10 pass 0 fail",
      "passed": true
    },
    {
      "cmd": null,
      "evidence": "generator tests test_each_project_gets_its_own_ports, test_port_blocks_and_overrides (mutation-checked)",
      "passed": true
    },
    {
      "cmd": null,
      "evidence": "blueprint ./dev check 29/29 with DEV_PG_PORT=55433 override",
      "passed": true
    }
  ],
  "unresolved": [],
  "lessons": [],
  "next_steps": [],
  "created_at": "2026-10-06T06:57:09Z"
}
