{
  "result_schema_version": 1,
  "task_id": "T-0005",
  "outcome": "completed",
  "summary": "Browser ↔ Rust BFF ↔ PostgreSQL path proven end to end: login via OIDC, secure HttpOnly SameSite cookie + CSRF header, CRUD on the example domain, invitations, realtime SSE authenticated.",
  "changes": [],
  "decisions": [],
  "validation": [
    {
      "cmd": null,
      "evidence": "python3 tools/ai-validate (Rust fmt/clippy/sqlx/tests/cedar + web typecheck/lint/test/build/budget) and Playwright 12/12 E2E PASS on 2026-10-04",
      "passed": true
    },
    {
      "cmd": null,
      "evidence": "tenancy.spec.ts lifecycle; auth.spec.ts cookie attributes and no tokens in web storage",
      "passed": true
    }
  ],
  "unresolved": [],
  "lessons": [],
  "next_steps": [],
  "created_at": "2026-10-04T09:59:33Z"
}
