{
  "result_schema_version": 1,
  "task_id": "T-0022",
  "outcome": "completed",
  "summary": "Append-only audit (triggers) in-transaction with sensitive changes, scrubbed metadata, audited denials; API keys (prefix/env/id/secret, HMAC pepper, scopes, expiry, last-used, revocation, rotation overlap, bounded by creator); service JWTs via JWKS mapped to registered service clients.",
  "changes": [],
  "decisions": [],
  "validation": [
    {
      "cmd": null,
      "evidence": "python3 tools/ai-validate (Rust fmt/clippy/sqlx/tests/cedar + web typecheck/lint/test/build/budget) and Playwright 12/12 E2E PASS on 2026-10-04",
      "passed": true
    },
    {
      "cmd": null,
      "evidence": "credentials.rs 3; repositories.rs audit tests",
      "passed": true
    }
  ],
  "unresolved": [],
  "lessons": [],
  "next_steps": [],
  "created_at": "2026-10-04T09:59:33Z"
}
