{
  "result_schema_version": 1,
  "task_id": "T-0012",
  "outcome": "completed",
  "summary": "Pingora gateway (hyperscale profile) built as a separate workspace (LB, health checks, pooled upstreams) and measured direct vs proxied vs nginx at equal workers. Result: a proxy hop roughly halves trivial-endpoint throughput on a shared host (+0.5 ms p50); Pingora ~ nginx; ~45 us CPU/request. Decision: available, off by default; adopt for programmable edge logic on dedicated nodes (ADR 0009).",
  "changes": [],
  "decisions": [],
  "validation": [
    {
      "cmd": null,
      "evidence": "benchmarks/results/20261004T140349Z-0cd96a42816b-pingora-vs-nginx.json",
      "passed": true
    },
    {
      "cmd": null,
      "evidence": "benchmarks/results/20261004T135911Z-0cd96a42816b-pingora.json (gateway CPU/RSS)",
      "passed": true
    },
    {
      "cmd": null,
      "evidence": "cargo clippy (backend/gateway) clean; docs/benchmarks/pingora.md; ADR 0009",
      "passed": true
    }
  ],
  "unresolved": [],
  "lessons": [],
  "next_steps": [],
  "created_at": "2026-10-04T14:10:46Z"
}
