{
  "result_schema_version": 1,
  "task_id": "T-0003",
  "outcome": "completed",
  "summary": "SolidJS + strict TypeScript + Vite frontend: router with lazy route groups (separate chunks), typed API client over ts-rs bindings, SSE realtime client, session/auth integration, error boundaries, telemetry hooks, accessible responsive design system, strict-CSP-compatible build.",
  "changes": [],
  "decisions": [],
  "validation": [
    {
      "cmd": null,
      "evidence": "python3 tools/ai-validate (Rust fmt/clippy/sqlx/tests/cedar + web typecheck/lint/test/build/budget) and Playwright 12/12 E2E PASS on 2026-10-04",
      "passed": true
    },
    {
      "cmd": null,
      "evidence": "Unit tests 14 (Vitest); bundle: initial 38.1 KB gzip, largest route 7.8 KB (scripts/bundle-size.mjs); E2E CSP guard and axe WCAG 2.2 AA pass",
      "passed": true
    }
  ],
  "unresolved": [],
  "lessons": [],
  "next_steps": [],
  "created_at": "2026-10-04T09:59:33Z"
}
