{
  "result_schema_version": 1,
  "task_id": "T-0015",
  "outcome": "completed",
  "summary": "create-project generates independent projects (own git history, compose project, derived protocol instance) for any profile/auth combination; optional modules are cargo features + config + compose profile + CI service + validation command, pruned when unselected; scripts/validate-generated proves each project end to end.",
  "changes": [],
  "decisions": [],
  "validation": [
    {
      "cmd": null,
      "evidence": "python3 -m unittest discover -s scripts/tests: 4 tests OK (core b2b defaults, basic without admin, full + cedar + gateway incl. Redis URL/adapter and CI services, invalid combinations)",
      "passed": true
    },
    {
      "cmd": null,
      "evidence": "scripts/validate-generated on minimal (core/basic/no-admin): OK, ./dev check 22/22, system smoke 10 pass 3 skip, unselected modules absent from binary/services/config (2026-10-05T02:32Z)",
      "passed": true
    },
    {
      "cmd": null,
      "evidence": "scripts/validate-generated on saas (performance/b2b/admin/cedar): OK, ./dev check 23/23, Redis running and compiled in (2026-10-05T02:38Z)",
      "passed": true
    },
    {
      "cmd": null,
      "evidence": "scripts/validate-generated on throughput (distributed/b2b): OK, ./dev check 25/25, system smoke 12 pass 1 skip incl. NATS + ClickHouse (2026-10-05T02:46Z)",
      "passed": true
    }
  ],
  "unresolved": [],
  "lessons": [],
  "next_steps": [],
  "created_at": "2026-10-05T02:53:01Z"
}
